"1","01","Banh Uot Cha Lua","7.5","Sliced cured pork and fried shrimp pancake served with thick rice noodles","Image here","2013-03-04T17:14:26-08:00","2013-03-04T17:14:26-08:00"
"2","02","Bun Thit Xao","7.5","Marinated pork served with onions, peanuts and thin rice noodles","Image here","2013-03-04T17:14:26-08:00","2013-03-04T17:14:26-08:00"
"3","03",Chao Long,7,"Pork based porridge served with cilantro, fried onions, and black pepper ","Image here","2013-03-04T17:14:26-08:00","2013-03-04T17:14:26-08:00"
"4","04","Hu Tieu Mi","7.5","Shrimp and pork soup served with both rice and egg noodles","Image here","2013-03-04T17:14:26-08:00","2013-03-04T17:14:26-08:00"
"5","05","Bun Mam","8","Fish based soup with boiled pork, shrimp, and fish served with thin rice noodles","Image here","2013-03-04T17:14:26-08:00","2013-03-04T17:14:26-08:00"
"6","06","Banh Mi Bo Kho","7","Beef stew and carrots served with french bread","Image here","2013-03-04T17:14:26-08:00","2013-03-04T17:14:26-08:00"
"7","07","Hu Tieu Nam Vang","8","Clear noodle soup with pork, shrimp and a fried shrimp pancake","Image here","2013-03-04T17:14:26-08:00","2013-03-04T17:14:26-08:00"
"8","08","Banh Mi Xiu Mai","5","Sweet pork meat balls served with french bread","Image here","2013-03-04T17:14:26-08:00","2013-03-04T17:14:26-08:00"